<?xml version="1.0" encoding="utf-8"?>
<!--  
        UNCLASSIFIED//FOR OFFICIAL USE ONLY
        DISTRIBUTION STATEMENT C
    This document is property of the U.S. Government. Distribution authorized to U.S. Government 
    Agencies and their contractors (date of determination as of February 15, 2018). Other 
    requests for this document shall be referred to the VICTORY Standards Support Office (VSSO).
-->
<!--
    Version = 1.6
    Release Date = 20131031
-->
<xsd:schema xmlns:xsd="http://www.w3.org/2001/XMLSchema"
    xmlns:vcl="http://www.victory-standards.org/Schemas/VICTORYConfigurationLanguage.xsd"
    xmlns:vmt="http://www.victory-standards.org/Schemas/VICTORYManagementTypes.xsd"
    xmlns:vst="http://www.victory-standards.org/Schemas/VICTORYSharedTypes.xsd"
    targetNamespace="http://www.victory-standards.org/Schemas/VICTORYConfigurationLanguage.xsd"
    elementFormDefault="qualified" version="1.6">
    <xsd:import namespace="http://www.victory-standards.org/Schemas/VICTORYManagementTypes.xsd"
        schemaLocation="VICTORYManagementTypes.xsd"/>
    <xsd:import namespace="http://www.victory-standards.org/Schemas/VICTORYSharedTypes.xsd"
        schemaLocation="VICTORYSharedTypes.xsd"/>
    <xsd:import namespace="http://www.w3.org/2003/05/soap-envelope"
        schemaLocation="soap-envelope.xsd"/>
    <xsd:element name="VCL">
        <xsd:annotation>
            <xsd:appinfo>
                <maturity>Proposed Standard</maturity>
            </xsd:appinfo>
        </xsd:annotation>
        <xsd:complexType>
            <xsd:sequence>
                <xsd:element maxOccurs="unbounded" minOccurs="0" name="configItem"
                    type="vcl:configItem_t"/>
                <xsd:element maxOccurs="unbounded" minOccurs="0" name="configGroup"
                    type="vcl:configGroup_t"/>
            </xsd:sequence>
        </xsd:complexType>
    </xsd:element>
    <xsd:complexType name="configItem_t">
        <xsd:annotation>
            <xsd:appinfo>
                <maturity>Proposed Standard</maturity>
            </xsd:appinfo>
        </xsd:annotation>
        <xsd:attribute name="name" type="xsd:string" use="required"/>
        <xsd:attribute name="value" type="xsd:string" use="required"/>
    </xsd:complexType>
    <xsd:complexType name="configGroup_t">
        <xsd:annotation>
            <xsd:appinfo>
                <maturity>Proposed Standard</maturity>
            </xsd:appinfo>
        </xsd:annotation>
        <xsd:sequence>
            <xsd:element maxOccurs="unbounded" minOccurs="0" name="configItem"
                type="vcl:configItem_t"/>
            <xsd:element maxOccurs="unbounded" minOccurs="0" name="configGroup"
                type="vcl:configGroup_t"/>
        </xsd:sequence>
        <xsd:attribute name="name" type="xsd:string" use="required"/>
        <xsd:attribute name="type" type="xsd:string"/>
    </xsd:complexType>
    <xsd:complexType name="vcl_t">
        <xsd:annotation>
            <xsd:appinfo>
                <maturity>Proposed Standard</maturity>
            </xsd:appinfo>
        </xsd:annotation>
        <xsd:sequence>
            <xsd:element maxOccurs="unbounded" minOccurs="0" name="configItem"
                type="vcl:configItem_t"/>
            <xsd:element maxOccurs="unbounded" minOccurs="0" name="configGroup"
                type="vcl:configGroup_t"/>
        </xsd:sequence>
    </xsd:complexType>
    <xsd:simpleType name="maturity_t">
        <xsd:annotation>
            <xsd:appinfo>
                <maturity>Proposed Standard</maturity>
            </xsd:appinfo>
        </xsd:annotation>
        <xsd:restriction base="xsd:string">
            <xsd:enumeration value="Preliminary"/>
            <xsd:enumeration value="Experimental"/>
            <xsd:enumeration value="Proposed Standard"/>
            <xsd:enumeration value="Draft Standard"/>
            <xsd:enumeration value="VICTORY Standard"/>
        </xsd:restriction>
    </xsd:simpleType>
    <xsd:element name="getConfiguration">
        <xsd:annotation>
            <xsd:appinfo>
                <maturity>Proposed Standard</maturity>
            </xsd:appinfo>
        </xsd:annotation>
        <xsd:complexType/>
    </xsd:element>
    <xsd:element name="getConfigurationResponse">
        <xsd:annotation>
            <xsd:appinfo>
                <maturity>Proposed Standard</maturity>
            </xsd:appinfo>
        </xsd:annotation>
        <xsd:complexType>
            <xsd:sequence>
                <xsd:element name="VCL" type="vcl:vcl_t"/>
                <xsd:element name="components" minOccurs="0">
                    <xsd:complexType>
                        <xsd:sequence>
                            <xsd:element maxOccurs="unbounded" name="componentErrors"
                                type="vmt:componentErrors_t"/>
                        </xsd:sequence>
                    </xsd:complexType>
                </xsd:element>
            </xsd:sequence>
        </xsd:complexType>
    </xsd:element>
    <xsd:element name="setConfiguration">
        <xsd:annotation>
            <xsd:appinfo>
                <maturity>Proposed Standard</maturity>
            </xsd:appinfo>
        </xsd:annotation>
        <xsd:complexType>
            <xsd:sequence>
                <xsd:element name="VCL" type="vcl:vcl_t">
                    <xsd:annotation>
                    </xsd:annotation>
                </xsd:element>
            </xsd:sequence>
        </xsd:complexType>
    </xsd:element>
    <xsd:element name="setConfigurationResponse">
        <xsd:annotation>
            <xsd:appinfo>
                <maturity>Proposed Standard</maturity>
            </xsd:appinfo>
        </xsd:annotation>
        <xsd:complexType>
            <xsd:sequence>
                <xsd:element name="components">
                    <xsd:complexType>
                        <xsd:sequence>
                            <xsd:element maxOccurs="unbounded" name="componentErrors"
                                type="vmt:componentErrors_t"/>
                        </xsd:sequence>
                    </xsd:complexType>
                </xsd:element>
            </xsd:sequence>
        </xsd:complexType>
    </xsd:element>
</xsd:schema>
<!--    DISTRIBUTION STATEMENT C    -->
<!--    UNCLASSIFIED//FOR OFFICIAL USE ONLY    -->
